{
  "profile": "api-port",
  "sdks": {
    "react-native-google-mobile-ads": {
      "why": "banner ads on the task list",
      "pods": [
        "Google-Mobile-Ads-SDK",
        "GoogleUserMessagingPlatform"
      ],
      "tracking": true,
      "collects": [
        {
          "type": "device-id",
          "linked": true,
          "tracking": true,
          "purposes": [
            "third-party-advertising",
            "developer-advertising",
            "analytics"
          ]
        },
        {
          "type": "coarse-location",
          "linked": true,
          "tracking": false,
          "purposes": [
            "third-party-advertising",
            "developer-advertising",
            "analytics",
            "app-functionality"
          ]
        },
        {
          "type": "crash-data",
          "linked": false,
          "tracking": false,
          "purposes": [
            "analytics"
          ]
        },
        {
          "type": "advertising-data",
          "linked": true,
          "tracking": false,
          "purposes": [
            "third-party-advertising",
            "developer-advertising",
            "analytics"
          ]
        },
        {
          "type": "product-interaction",
          "linked": true,
          "tracking": false,
          "purposes": [
            "third-party-advertising",
            "developer-advertising",
            "analytics",
            "app-functionality"
          ]
        },
        {
          "type": "performance-data",
          "linked": false,
          "tracking": false,
          "purposes": [
            "third-party-advertising",
            "developer-advertising",
            "analytics",
            "app-functionality"
          ]
        },
        {
          "type": "other-diagnostic-data",
          "linked": false,
          "tracking": false,
          "purposes": [
            "third-party-advertising",
            "developer-advertising",
            "analytics"
          ]
        }
      ]
    }
  },
  "app": {
    "collects": []
  },
  "permissionAnswers": {},
  "accountDeletion": null
}
